{"case_id":"contract-fixture","data_audit_ref":"data-audit","producer":"framer","questions":[{"constraints":[],"inputs":["problem"],"objective":{"description":"Estimate holdout responses","metric":"mse","sense":"min"},"outputs":[{"fields":[{"name":"value","type":"number","unit":"1"}],"format":"json","name":"prediction","path":"results/predictions.json","precision":6}],"question_id":"Q1","resources":{"memory_mb":null,"timeout_seconds":30},"source_refs":["problem:line1"],"task_type":"regression","title":"Synthetic prediction task"}],"schema_version":"2.0","source_refs":["problem"]}
